candidate_id,title,title_en,total_votes,vote_count,average_vote,title_original,budget_allocation
0,#vote_for Project,#vote_for Project,327,111,2.95,政を祭に変える #vote_forプロジェクト,30402
1,Awaji Island Quest College,Awaji Island Quest College,430,115,3.74,淡路島クエストカレッジ,39978
2,Inatori Art Center Plan,Inatori Art Center Plan,337,108,3.12,イナトリアートセンター計画,31331
3,JINEN TRAVEL,JINEN TRAVEL,330,104,3.17,JINEN TRAVEL,30681
4,Bio Rice Field Project,Bio Rice Field Project,415,114,3.64,ビオ田んぼプロジェクト,38583
5,Para Travel Support Team,Para Travel Support Team,373,114,3.27,パラ旅応援団,34678
6,Chiba Youth Center PRISM,Chiba Youth Center PRISM,477,117,4.08,10代・20代の「いま、やりたい」を後押しする拠点　ちばユースセンターPRISM,44347
